{
  "domain": "drive.co.uk",
  "angle_code": "no-owner",
  "recipient_role": "Head of Commercial",
  "subject": "drive.co.uk and AI search",
  "body": "Hello,\n\nI’ve been looking at which publishers AI search tools point UK car buyers to.\n\nIn a dated sample of UK buyer queries, drive.co.uk was cited in 44 of the 80 automotive answers.[^c1][^c2][^c3] That held across both runs of the sample.[^c4] For a sense of what that attention can be worth, blankspace reports a $15.02 average CPM on live accounts.[^c5]\n\nWould a 20-minute call to walk through the queries that cited you be useful?\n\nBest wishes",
  "claims": [
    {
      "id": "c1",
      "text": "Cited in 44 automotive answers",
      "type": "evidence",
      "ref": "/signals/readership/probes_cited",
      "asserted_value": 44
    },
    {
      "id": "c2",
      "text": "Out of 80 automotive answers",
      "type": "evidence",
      "ref": "/signals/readership/probes_total",
      "asserted_value": 80
    },
    {
      "id": "c3",
      "text": "Vertical: automotive",
      "type": "evidence",
      "ref": "/vertical",
      "asserted_value": "automotive"
    },
    {
      "id": "c4",
      "text": "Cited in both runs",
      "type": "evidence",
      "ref": "/signals/readership/stability",
      "asserted_value": "both_runs"
    },
    {
      "id": "c5",
      "text": "blankspace reports a $15.02 average CPM on live accounts",
      "type": "company_claim",
      "ref": "company-claims#cpm",
      "asserted_value": null
    }
  ],
  "verifier_run_id": "vr-07235355"
}
